{
	"$schema": "../.schemas/collection.schema.json",
	"slug": "pages",
	"label": "Pages",
	"labelSingular": "Page",
	"supports": [
		"drafts",
		"revisions",
		"seo"
	],
	"fields": [
		{
			"slug": "title",
			"label": "Title",
			"type": "string",
			"required": true
		},
		{
			"slug": "content",
			"label": "Content",
			"type": "portableText"
		}
	]
}
